{
  "schemaVersion": "1.0",
  "generatedAt": "2026-09-14T06:00:32.000Z",
  "coverage": {
    "geography": "Celý svět",
    "historyFrom": "2023-09-14",
    "products": [
      "Malorážové střelivo",
      "Speciální a cvičné střelivo",
      "Komponenty střeliva"
    ],
    "note": "Rozšířený monitoring veřejných zdrojů k 14. 9. 2026: otevřené soutěže, plánované příležitosti a relevantní výsledky z posledních tří let pro malorážové, speciální a cvičné střelivo a komponenty střeliva."
  },
  "tenders": [
    {
      "id": "TED-534331-2026",
      "title": "Frangible výcvikové střelivo 5,56×45 a 9×19 mm",
      "buyer": "Estado-Maior do Exército",
      "country": "Portugalsko",
      "region": "Evropa",
      "productArea": "Speciální a cvičné střelivo",
      "calibers": [
        "5.56×45 mm frangible",
        "9×19 mm frangible"
      ],
      "status": "closed",
      "relevance": 95,
      "value": 480000,
      "currency": "EUR",
      "publishedAt": "2026-08-03",
      "deadline": "2026-09-10",
      "firstSeen": "2026-09-07",
      "lastChecked": "2026-09-14",
      "isNew": false,
      "changedFields": [],
      "summary": "Portugalská armáda soutěží dvě relevantní části na frangible střelivo 5,56×45 mm a 9×19 mm, každou v hodnotě 240 000 EUR. Třetí část se týká cvičných ručních granátů.",
      "managementNote": "Výborná produktová shoda pro výcvikové portfolio. Termín je kritický; ihned prověřit samostatnost částí a požadavky na zkoušky.",
      "risks": [
        "Uzávěrka během několika dnů",
        "Součást vícekomoditního řízení",
        "Dokumentace v portugalštině"
      ],
      "verification": "Ověřeno v aktuálním oznámení TED; termín a veřejné parametry zkontrolovány 7. 9. 2026. Lhůta pro podání nabídek 10. 9. 2026 uplynula; při kontrole 11. 9. 2026 nebylo v oficiálním záznamu zjištěno prodloužení.",
      "source": {
        "name": "TED – Tenders Electronic Daily",
        "url": "https://ted.europa.eu/en/notice/-/detail/534331-2026"
      }
    },
    {
      "id": "TED-469290-2026",
      "title": "Policejní náboje .308 HPBT 168 gr – část 6",
      "buyer": "Ministero dell’Interno – Dipartimento della Pubblica Sicurezza",
      "country": "Itálie",
      "region": "Evropa",
      "productArea": "Speciální a cvičné střelivo",
      "calibers": [
        ".308 Winchester HPBT 168 gr"
      ],
      "status": "closed",
      "relevance": 86,
      "value": 480000,
      "currency": "EUR",
      "publishedAt": "2026-07-08",
      "deadline": "2026-09-10",
      "firstSeen": "2026-09-07",
      "lastChecked": "2026-09-14",
      "isNew": false,
      "changedFields": [],
      "summary": "V šesté části širší italské policejní zakázky jsou poptávány přesné náboje .308 Winchester s projektilem HPBT 168 grain v odhadované hodnotě 480 000 EUR.",
      "managementNote": "Relevantní přesnostní část lze hodnotit odděleně od ostatního policejního vybavení. Termín vyžaduje okamžité rozhodnutí.",
      "risks": [
        "Uzávěrka během několika dnů",
        "Zakázka má osm různorodých částí",
        "Italská dokumentace a možné vzorkování"
      ],
      "verification": "Ověřeno v aktuálním oznámení TED; termín a veřejné parametry zkontrolovány 7. 9. 2026. Lhůta pro podání nabídek 10. 9. 2026 uplynula; při kontrole 11. 9. 2026 nebylo v oficiálním záznamu zjištěno prodloužení.",
      "source": {
        "name": "TED – Tenders Electronic Daily",
        "url": "https://ted.europa.eu/en/notice/-/detail/469290-2026"
      }
    },
    {
      "id": "US-USSS-70US0926R70093916",
      "title": "40mm less-lethal, kouřové a FN303 střelivo a komponenty",
      "buyer": "United States Secret Service",
      "country": "Spojené státy",
      "region": "Severní Amerika",
      "productArea": "Speciální a cvičné střelivo",
      "calibers": [
        "40 mm less-lethal",
        "40 mm smoke",
        "FN303 ammunition and components"
      ],
      "status": "closed",
      "relevance": 82,
      "value": null,
      "currency": "USD",
      "publishedAt": "2026-08-21",
      "deadline": "2026-09-10",
      "firstSeen": "2026-09-09",
      "lastChecked": "2026-09-14",
      "isNew": true,
      "changedFields": [],
      "summary": "United States Secret Service poptává 40mm méně smrtící a kouřové střelivo spolu s municí a komponenty FN303. Dodatek č. 4 zveřejněný 8. září znovu prodloužil lhůtu pro nabídky.",
      "managementNote": "Aktuální specializovaná příležitost s velmi krátkým termínem. Prověřit rozsah položek a možnost účasti přes způsobilý americký malý podnik.",
      "risks": [
        "Uzávěrka je 10. 9. 2026 ve 14:00 EDT",
        "Soutěž je vyhrazena americkým malým podnikům",
        "Veřejný souhrn neuvádí hodnotu ani množství jednotlivých položek"
      ],
      "verification": "Ověřeno 9. 9. 2026 v aktuálním oficiálním oznámení SAM.gov po dodatku č. 4; stav Active a nová lhůta 10. 9. 2026 ve 14:00 EDT. Lhůta pro podání nabídek 10. 9. 2026 uplynula; při kontrole 11. 9. 2026 nebylo v oficiálním záznamu zjištěno prodloužení.",
      "source": {
        "name": "SAM.gov",
        "url": "https://sam.gov/opp/fb18fc66fc344541865458c54a6208fe/view"
      }
    },
    {
      "id": "US-FLETC-70LCHS26QPFB00040",
      "title": "9mm UTX výcvikové střelivo pro FLETC Charleston",
      "buyer": "U.S. Department of Homeland Security – Federal Law Enforcement Training Centers",
      "country": "Spojené státy",
      "region": "Severní Amerika",
      "productArea": "Speciální a cvičné střelivo",
      "calibers": [
        "9 mm UTX"
      ],
      "status": "closed",
      "relevance": 79,
      "value": null,
      "currency": "USD",
      "publishedAt": "2026-09-08",
      "deadline": "2026-09-10",
      "firstSeen": "2026-09-10",
      "lastChecked": "2026-09-14",
      "isNew": true,
      "changedFields": [],
      "summary": "Federal Law Enforcement Training Center v Charlestonu poptává výcvikové střelivo 9 mm UTX. Veřejné oznámení odkazuje na přiloženou zadávací dokumentaci a stanoví termín pro nabídky na 10. září 2026.",
      "managementNote": "Specializovaná výcviková poptávka s termínem ještě dnes. Prověřit dokumentaci, množství a možnost rychlé účasti přes americký distribuční kanál.",
      "risks": [
        "Uzávěrka je 10. 9. 2026 v 09:00 EDT",
        "Veřejný souhrn neuvádí množství ani hodnotu",
        "Mohou platit americké původové a distribuční podmínky"
      ],
      "verification": "Ověřeno 10. 9. 2026 v aktuálním oficiálním oznámení SAM.gov; stav Active, Notice ID 70LCHS26QPFB00040 a lhůta 10. 9. 2026 v 09:00 EDT. Lhůta pro podání nabídek 10. 9. 2026 uplynula; při kontrole 11. 9. 2026 nebylo v oficiálním záznamu zjištěno prodloužení.",
      "source": {
        "name": "SAM.gov",
        "url": "https://sam.gov/opp/d3095e158ddd43029355723f5ac2ae7c/view"
      }
    },
    {
      "id": "DE-B9352-2-2026",
      "title": "144 000 nábojů 9×19 mm s frangible střelou pro policii",
      "buyer": "Polizeipräsidium für Service und IT Sachsen",
      "country": "Německo",
      "region": "Evropa",
      "productArea": "Speciální a cvičné střelivo",
      "calibers": [
        "9×19 mm frangible"
      ],
      "status": "closed",
      "relevance": 92,
      "value": null,
      "currency": "EUR",
      "publishedAt": "2026-08-13",
      "deadline": "2026-09-11",
      "firstSeen": "2026-09-07",
      "lastChecked": "2026-09-14",
      "isNew": false,
      "changedFields": [],
      "summary": "Saská policie poptává 144 000 nábojů 9×19 mm se střelou, která se po zásahu rozpadá. Dodání je požadováno nejpozději do 29. ledna 2027.",
      "managementNote": "Velmi dobrá shoda pro speciální 9mm střelivo, ale krátká lhůta. Ihned prověřit německou dokumentaci, zkoušky a termín dodání.",
      "risks": [
        "Uzávěrka během několika dnů",
        "Specifické chování střely a zkušební požadavky",
        "Hodnota nebyla zveřejněna"
      ],
      "verification": "Ověřeno na oficiálním zadávacím portálu Svobodného státu Sasko. Lhůta 11. 9. 2026 uplynula; při kontrole 12. 9. 2026 nebylo v dostupném oficiálním záznamu zjištěno prodloužení.",
      "source": {
        "name": "eVergabe Sachsen",
        "url": "https://www.evergabe.sachsen.de/NetServer/PublicationControllerServlet?PublicationType=0&TWOID=54321-Tender-19fb8194b5c-3b4d91e48fc91a58&function=Detail"
      }
    },
    {
      "id": "TED-499812-2026",
      "title": "Munice 7,62×39 mm pro AK a 7,62×54 mm pro Dragunov",
      "buyer": "Belgické ministerstvo obrany",
      "country": "Belgie",
      "region": "Evropa",
      "productArea": "Malorážové střelivo",
      "calibers": [
        "7.62×39 mm Ball",
        "7.62×54 mm Ball"
      ],
      "status": "closed",
      "relevance": 91,
      "value": null,
      "currency": "EUR",
      "publishedAt": "2026-07-20",
      "deadline": "2026-09-11",
      "firstSeen": "2026-09-07",
      "lastChecked": "2026-09-14",
      "isNew": false,
      "changedFields": [],
      "summary": "Belgické ministerstvo obrany připravuje víceletý nákup nábojů 7,62×39 mm Ball pro AK-47/AKM a 7,62×54 mm Ball pro pušky Dragunov, s plněním do roku 2032.",
      "managementNote": "Zajímavý dlouhodobý obranný odběr. Okamžitě ověřit kvalifikaci, jazyk podání a předpokládané objemy jednotlivých ráží.",
      "risks": [
        "Krátká lhůta pro žádost o účast",
        "Vyjednávací obranné řízení",
        "Množství ani hodnota nejsou ve veřejném souhrnu"
      ],
      "verification": "Ověřeno v aktuálním oznámení TED; termín a veřejné parametry zkontrolovány 7. 9. 2026. Lhůta 11. 9. 2026 uplynula; při kontrole 12. 9. 2026 nebylo v dostupném oficiálním záznamu zjištěno prodloužení.",
      "source": {
        "name": "TED – Tenders Electronic Daily",
        "url": "https://ted.europa.eu/en/notice/-/detail/499812-2026"
      }
    },
    {
      "id": "US-ANG-2026-AMMO-001",
      "title": "26 000 nábojů .223 a 9 mm pro výcvik Arkansas National Guard",